#,Title,abstract,venue,year,doi,authors,relative_citation_index,relevance_score
202,Investigation of Cloud Scheduling Algorithms for Resource Utilization Using CloudSim,"Compute Cloud comprises a distributed set of High-Performance Computing (HPC) machines to stipulate on-demand computing services to remote users over the internet. Clouds are capable enough to provide an optimal solution to address the ever-increasing computation and storage demands of large scientific HPC applications. To attain good computing performances, mapping of Cloud jobs to the compute resources is a very crucial process. Currently we can say that several efficient Cloud scheduling heuristics are available, however, selecting an appropriate scheduler for the given environment (i.e., jobs and machines heterogeneity) and scheduling objectives (such as minimized makespan, higher throughput, increased resource utilization, load balanced mapping, etc.) is still a difficult task. In this paper, we consider ten important scheduling heuristics (i.e., opportunistic load balancing algorithm, proactive simulation-based scheduling and load balancing, proactive simulation-based scheduling and enhanced load balancing, minimum completion time, Min-Min, load balance improved Min-Min, Max-Min, resource-aware scheduling algorithm, task-aware scheduling algorithm, and Sufferage) to perform an extensive empirical study to insight the scheduling mechanisms and the attainment of the major scheduling objectives. This study assumes that the Cloud job pool consists of a collection of independent and compute-intensive tasks that are statically scheduled to minimize the total execution time of a workload. The experiments are performed using two synthetic and one benchmark GoCJ workloads on a renowned Cloud simulator CloudSim. This empirical study presents a detailed analysis and insights into the circumstances requiring a load balanced scheduling mechanism to improve overall execution performance in terms of makespan, throughput, and resource utilization. The outcomes have revealed that the Sufferage and task-aware scheduling algorithm produce minimum makespan for the Cloud jobs. However, these two scheduling heuristics are not efficient enough to exploit the full computing capabilities of Cloud virtual machines.",Computing and informatics,2019,10.31577/cai_2019_3_525,"Muhammad Aleem, A. Hussain, Muhammad Arshad Islam, M. Iqbal",3.0,1
217,Cluster-based Analysis of Multi-Parameter Distributions in Cloud Simulation Ensembles,"The proposed approach enables a comparative visual exploration of multi-parameter distributions in time-varying 3D ensemble simulations. To investigate whether dominant trends in such distributions occur, we consider the simulation elements in each dataset—per ensemble member and time step—as elements in the multi-dimensional parameter space, and use t-SNE to project these elements into 2D space. To find groups of elements with similar parameter values in each time step, the resulting projections are clustered via k-Means. Since elements with similar data values can be disconnected in one single projection, we compute an ensemble of projections using multiple t-SNE runs and use evidence accumulation to determine sets of elements that are stably clustered together. We build upon per-cluster multi-parameter distribution functions to quantify cluster similarity, and merge clusters in different ensemble members. By applying the proposed approach to a time-varying ensemble, the temporal development of clusters, and in particular their stability over time can be analyzed. We apply this approach to analyze a time-varying ensemble of 3D cloud simulations. The visualizations via t-SNE, parallel coordinate plots and scatter plot matrices show dependencies between the simulation results and the simulation parameters used to generate the ensemble, and they provide insight into the temporal ensemble variability regarding the major trends in the multi-parameter distributions.","International Symposium on Vision, Modeling, and Visualization",2019,10.1109/tvcg.2018.2864901,"Josef Stumpfegger, Alexander Kumpf, R. Westermann",3.0,1
238,An Introduction of CloudSim Simulation tool for Modelling and Scheduling,"Cloud computing goals are to deliver secure, maintainable, fault-tolerant and reliable infrastructure for application services based on the net. To schedule and modeling the different services and applications on the cloud is a challenging job with different energy and load performances. The research on Cloud computing is still at the early stage and in order to resolve this problem CloudSim is introduced. CloudSim is a simulation tool, that has the ability to manage various services, scheduling the services and modeling infrastructure of the cloud. This paper also aims to provide the importance of simulation for performing various experimental beds with the case study of one of the simulation tools CloudSim. It also discussed its architecture, features with design and application. Last, this paper also supplies the installation steps to use CloudSim in NetBeans IDE and Eclipse.",2020 International Conference on Emerging Smart Computing and Informatics (ESCI),2020,10.1109/esci48226.2020.9167549,"Amit Sundas, S. Panda",3.0,1
183,Modelling resource heterogeneities in cloud simulations and quantifying their accuracy,,Simulation modelling practice and theory,2019,10.1016/j.simpat.2019.02.003,"Lee Gillam, M. Zakarya",2.6666669999999999,1
191,IoTSim-Stream: Modelling stream graph application in cloud simulation,,Future generations computer systems,2019,10.1016/j.future.2019.04.004,"R. Calheiros, S. Garg, R. Ranjan, M. Barika, Andrew Chan",2.6666669999999999,1
169,Self Organizing Map Based Evaluation of Present Day GCM Cloud Simulations,,,2018,10.1002/2017jd028196,A. Schuddeboom,2.5714290000000002,1
171,Scheduler hierarchies to aid peta-scale cloud simulations with DISSECT-CF,"IaaS cloud simulators are frequently used for evaluating new scheduling practices. Unfortunately, most of these simulators scarcely allow the evaluation of larger-scale cloud infrastructures (i.e., with physical machine counts over a few thousand). Thus, they are seldom applicable for evaluating infrastructures available in commercial cloud settings (e.g., users mostly do not wait for simulations to complete in such settings). DISSECT-CF was shown to be better scaling than several other simulators, but peta-scale infrastructures with often millions of CPU cores were out of scope for DISSECT-CF as well. This paper reveals a hierarchical scheduler extension of DISSECT-CF that not only allows its users to evaluate peta-scale infrastructure behaviour, but also opens possibilities for analysing new multi-cloud scheduling techniques. The paper then analyses the performance of the extended simulator through large-scale synthetic workloads and compares its performance to DISSECT-CF's past behaviour. Based on the analysis, the paper concludes with recommended simulation setups that will allow the evaluation of new schedulers for peta-scale clouds in a timely fashion (e.g., within minutes).",,2015,10.1287/moor.2014.0694,Gábor Kecskeméti,2.4,1
133,A Comparative Analysis of Cloud Simulators,"Cloud Computing is a new paradigm which allows individuals and organizations to purchase resources like compute, storage, networking etc as a utility with minimum human intervention. According to recent surveys more than half of the large to medium size organizations have already migrated to the cloud. Despite of providing resources as a utility and its wide spread acceptance in the IT community, cloud computing is still at its prime and poses many challenges like automated service provisioning, virtual machine migration, server consolidation, energy management, traffic analysis, data security, software frameworks which needs considerable amount of research to stabilize. Conducting research on live cloud environments for individuals or small institutions is very difficult due to the costs involved in setting up a cloud. This paper presents various cloud simulators which were developed over the years that are a cost effective way of conducting cloud research tasks. This paper compares almost 17 cloud simulators based on diverse criteria and the result and explanations are presented which enables new researchers to choose a suitable cloud simulator.",,2016,10.5815/ijmecs.2016.04.08,Suryateja Satya Pericherla,2.3333330000000001,1
186,Simulating the Resource Freeing Attack: Using Cloudsim Simulator,"Virtualization is a technique to make the cloud computations secure. This technique can reduce the costs and increase the reliability of systems by means of sharing the physical resources between several VMs (Virtual Machines). However, virtualized environments are vulnerable to some security issues such as lack of performance isolation. These days, using the virtualization as a technique is growing slowly in large organizations. Despite these advantages, virtualizations have created several security challenges. So, the main concern of virtualization service providers and their customers is how to detect and encounter these security challenges. In this research, the resource freeing attack is selected among all available virtualization attacks because of its simplicity and its drastic effects. Resource freeing attack causes an unfair resource distribution among VMs. We use Cloudsim as a powerful cloud simulation toolkit to implement resource freeing attack. After simulating the attack, the CPU's efficiency, response time diagrams, and the obtained bandwidth are measured. The simulation results show the significant changes in VM behavior after occurring the attack in the virtualized environment. These changes help cloud providers to detect resource freeing attack in the cloud.",,2016,10.1177/0165551516654354,"M. Analoui, Shakiba Nayebalsadr",2.3333330000000001,1
231,Vehicular-cloud simulation framework for predicting traffic flow data,"The traffic flow prediction has become an important process tailored with the exponential development of cities and the transportation systems. The main purpose of the prediction task is to improve the logistic services and reduce the cost of the road congestion. In this paper, we propose a vehicular-cloud simulation framework with a layer of traffic cloud services to predict accurate traffic flow data. Learning of supervised traffic flow data from several data sources is the core of these services. Particularly, we focus on a particular type of dependency (i.e., monotone dependency) between the learning traffic inputs and its responses. The learning algorithm we propose aims to solve the regression problem by predicting values of a continuous measure. The accuracy of the proposed cloud services have been tested under congestion conditions, where the results show better performances over short periods and daily forecasts.",International Journal of Internet Technology and Secured Transactions,2020,10.1504/ijitst.2020.104578,"Sahraoui Abdelatif, Ahmed Ahmim, Derdour Makhlouf, P. Roose",2.2,1
119,Cloud simulators in the implementation and evaluation of virtual machine placement algorithms,"In recent years, many algorithms have been proposed for the optimized allocation of virtual machines in cloud data centers. Such algorithms are usually implemented and evaluated in a cloud simulator. This paper investigates the impact of the choice of cloud simulator on the implementation of the algorithms and on the evaluation results. In particular, we report our experiences with porting an algorithm and its evaluation framework from one simulator (CloudSim) to another (DISSECT‐CF). Our findings include limitations in the design of the simulators and in existing algorithm implementations. Based on this experience, we propose architectural guidelines for the integration of virtual machine allocation algorithms into cloud simulators.","Software, Practice & Experience",2018,10.1002/spe.2579,Z. Mann,2.142857000000000,1
157,Comparison of Various Cloud Simulation tools available in Cloud Computing,"2 Abstract: Cloud computing is sharing of computer hardware and software resources over the internet so that anyone who is connected to the internet can access it as a service in a seamless way. As we are moving more and more towards the application of this newly emerging technology, it is essential to study, evaluate and analyse the performance, security and other related problems that might be encountered in cloud computing. Since, it is not a feasible way to directly analyse the behaviour of cloud on such problems using the real hardware and software resources due to its high costs, modelling and simulation has become a very powerful tool to cope with these issues. In this paper, we review, analyse and compare features of the existing cloud computing modelling and simulation tools.",,2015,10.17148/ijarcce.2015.4342,"Mayank Shekhar, Utkal Sinha",2.1,1
63,Extending CloudSim to simulate sensor networks,"With the enormous growth of sensing devices tending to the use of Internet of everything, data aggregated by these devices are the biggest data streams generated in the history of IT. Thus, aggregating such data in the cloud for leveraging powerful cloud computing processing and storage is essential, and it eventually led to the emergence of Sensor-Cloud concept. This has allowed aggregation of the sensors’ data to the cloud for further processing, storage, and visualization. Furthermore, virtualization makes the sensors accessible to other end-user applications that require such data. All of these features are expected to be provided by the Sensor-Cloud invisibly, without the end-user application developer being aware of the sensor location or hardware specifications. For these reasons, a simulation platform where Sensor-Cloud infrastructure agents and components may be modeled, scheduling policies defined, and execution time assessed is essential to assure performance and quality of service. The aim of this study is to develop such a platform by enhancing CloudSim, the most well-known and powerful simulation tool for cloud computing. A user-friendly Java Script Swing-based graphical user interface (GUI) has been carefully designed and implemented for this purpose. The user can then utilize the specific interface to define the Cloudlet type as well as the scheduling on a single virtual machine. Finally, a simulation study is carried out on the platform to demonstrate its efficiency and accuracy. We were able to fully model the needed scenarios and acquire real-time results, displaying good accuracy in terms of application response time with a mean absolute percentage error (MAPE) of 3.37%, demonstrating the increased proposed platform’s proper operation.",International Conference on Advances in System Simulation,2022,10.1177/00375497221105530,"E. A. Elsheikh, F. Sliman, M. Habaebi, M. R. Islam, M. Mesri, Yacine Merrad",2.0,1
90,Parallel Application Performance Prediction Using Analysis Based Models and HPC Simulations,"Parallel application performance models provide valuable insight about the performance in real systems. Capable tools providing fast, accurate, and comprehensive prediction and evaluation of high-performance computing (HPC) applications and system architectures have important value. This paper presents PyPassT, an analysis based modeling framework built on static program analysis and integrated simulation of the target HPC architectures. More specifically, the framework analyzes application source code written in C with OpenACC directives and transforms it into an application model describing its computation and communication behavior (including CPU and GPU workloads, memory accesses, and message-passing transactions). The application model is then executed on a simulated HPC architecture for performance analysis. Preliminary experiments demonstrate that the proposed framework can represent the runtime behavior of benchmark applications with good accuracy.",SIGSIM Principles of Advanced Discrete Simulation,2018,10.1145/3200921.3200937,"S. Eidenbenz, Gopinath Chennupati, N. Santhi, M. Obaida, Jason Liu",2.0,1
226,"Energy-driven cloud simulation: existing surveys, simulation supports, impacts and challenges",,Cluster Computing,2020,10.1007/s10586-020-03068-4,Azlan B. Ismail,2.0,1
40,Secure Cloud Simulation Using Hybrid Algorithm,"Date of publication (dd/mm/yyyy): 03/12/2020 Abstract – At present, data security and privacy has been regarded as one of the biggest concerns in cloud computing. Data stored remotely is vulnerable and susceptible to threats. Due to this, users do not trust their data over the cloud. Cloud consumers want an assurance that they can access their data wherever they want without anyone else’s manipulation. Moreover, authentication of users over the cloud is another important factor to consider. After conducting surveys and studying various research papers it is found that the major security concerns of cloud computing includes Data leakage, Distributed Denial of Service (DDOS). The data security can be improvised by implementing various symmetric key algorithms so that data on the server is stored in such a manner that even if a person can access the data, they can't view the original data, as it needs to be decrypted. Including storage security, authorized access of users also helps in avoiding DDOS as only genuine users will have access to the cloud. A hybrid model, a mixture between elliptical curve cryptography and symmetric key algorithm in which ECC is used for user verification and to keep the private data secure while AES algorithm is used to allow the user to store and access their data securely in the cloud by encrypting the data on the client side and decrypting the data after downloading from the cloud. Since the private key is owned by the user of the data, none can decrypt the data, even if hackers get their hands on the data. Moreover, the user will securely authenticate themselves by using various input parameters at the time of login to the cloud server. The whole prototype of the proposed solution would benefit by enabling a proper access mechanism to avoid unauthorized access to the information system and secure storage to allow access of data.",,2020,10.1007/s12652-020-02082-z,"P. Divya, I. Jeya, B. Reena",1.8,1
94,Simulation of cloud infrastructure using CloudSim simulator: A practical approach for researchers,"Cloud Computing has evolved greatly in the recent years due to its characteristics of being secure, highly reliable, fault-tolerant, sustainable, and highly scalable, or we can say that it is capable of dynamically delivering IT resources over the Internet. Hence a lot of researchers and experts are working on improvising the cloud technology. To assess the performance of cloud environment, cloud simulators play an important role as it is a challenging task to perform experiments on the real cloud (which would incur huge cost in terms of currency if experiments are repeated). This paper gives a step by step practical approach towards simulating cloud components or cloud environment using the (open source) CloudSim simulator. It shows in-depth analysis and the factors responsible for simulating cloud concepts for your experiments or research or industry specific application.",International Conference on Systems Thinking in Management,2015,10.1109/icstm.2015.7225415,"Pravesh Humane, J. Varshapriya",1.8,1
195,Comparative Study of Task Scheduling Algorithms through Cloudsim,"Delivery of reliable services in cloud environment is a major issue. Reliability may be achieved by implementing the fault tolerance. Due to the abundant growth of traffic and service request on cloud datacenters, balancing the load in cloud environment is one of the serious challenges as failure may occur due to increase in power consumption, node failure, machine failure etc. Therefore there is a needof a policy for balancing the load among the datacenters and various solutions to balance the load have been proposed by researchers. Load distributionis the mechanism of dispersal the load between different nodes based on certain parameters such as underloaded(node) and overloaded (node). In this research articlewe have discussed the concept of dispersal of load and then perform a comparative analysis of various task-scheduling policies such as First Come First Serve, Shortest Job First and Round Robin onCloudsim.The simulation results on Cloudsim depicted that RR task-scheduling is much better than the FCFS and SJF whether we are using the Time shared policy or Space shared policy for execution of cloudlet.","2018 7th International Conference on Reliability, Infocom Technologies and Optimization (Trends and Future Directions) (ICRITO)",2018,10.1109/icrito.2018.8748514,"T. Zaidi, R. Pratap",1.7142860000000000,1
17,Virtual Machine Allocation Policy in Cloud Computing Using CloudSim in Java,"Cloud computing is a very powerful concept that can be used to enhance the next generation data center and allow service provider to use data center capability provided by cloud and develop the application based on user requirement. Data center of this cloud computing has huge number of resources and list of applications (with different architecture, configuration and requirement for deployment) want to use those resource. Cloud computing environment uses virtualization concept and provides resources to application by creating and allocating virtual machine to specific application. There for resource allocation policies and load balance policies play very vital role in allocating and managing the resources among various application in clod computing life cycle. CloudSim is an extensible simulation toolkit that enables modeling and simulation of Cloud computing environments. The model proposed by this paper for dynamic load balance policy with considering different attributes and different service level agreements in cloud computing environment helps this environment to utilize their resources and improves performance. The proposed model uses Hungarian algorithm and the result is verified by simulating this model using CloudSim.",,2015,10.14257/ijgdc.2015.8.1.14,"Haleema P K, N. S. N. Ch, Nagesh Hawanna, Iyengar, Jayasubalakshmi R, Kushang Parikh",1.7,1
221,Modelling and Simulation of ElasticSearch using CloudSim,"Simulation can be a powerful technique for evaluating the performance of large-scale cloud computing services in a relatively low cost, low risk and time-sensitive manner. Large-scale data indexing, distribution and management is complex to analyse in a timely manner. In this paper, we extend the CloudSim cloud simulation framework to model and simulate a distributed search engine architecture and its workload characteristics. To test the simulation framework, we develop a model based on a real-world ElasticSearch deployment on Linknovate.com. An experimental evaluation of the framework, comparing simulated and actual query response time, precision and resource utilisation, suggests that the proposed framework is capable of predicting performance at different scales in a precise, accurate and efficient manner. The results can assist ElasticSearch users to manage their scalability and infrastructure requirements.",IEEE International Symposium on Distributed Simulation and Real-Time Applications,2019,10.1109/ds-rt47707.2019.8958653,"James Byrne, Theo Lynn, M. Eduardo Ares, Patricia Takako Endo, Manuel Noya Mario, Sergej Svorobej, Malika Bendechache",1.6666669999999999,1
35,ContainerCloudSim: An environment for modeling and simulation of containers in cloud data centers,"Containers are increasingly gaining popularity and becoming one of the major deployment models in cloud environments. To evaluate the performance of scheduling and allocation policies in containerized cloud data centers, there is a need for evaluation environments that support scalable and repeatable experiments. Simulation techniques provide repeatable and controllable environments, and hence, they serve as a powerful tool for such purpose. This paper introduces ContainerCloudSim, which provides support for modeling and simulation of containerized cloud computing environments. We developed a simulation architecture for containerized clouds and implemented it as an extension of CloudSim. We described a number of use cases to demonstrate how one can plug in and compare their container scheduling and provisioning policies in terms of energy efficiency and SLA compliance. Our system is highly scalable as it supports simulation of large number of containers, given that there are more containers than virtual machines in a data center. Copyright © 2016 John Wiley & Sons, Ltd.","Software, Practice & Experience",2017,10.4018/978-1-5225-0759-8.ch017,"R. Calheiros, A. V. Dastjerdi, R. Buyya, Sareh Fotuhi Piraghaj",1.5,1
