#,Title,abstract,venue,year,doi,authors,relative_citation_index,relevance_score
43,CloudSimHypervisor: Modeling and Simulating Network Slicing in Software-Defined Cloud Networks,"Software-Defined Networking (SDN) is an innovative technology which provides a programmable network control which is decoupled from the physical infrastructure. Network Virtualization (NV) is the phenomenon where a given physical network infrastructure and its resources are abstracted to create multiple logical virtual network slices of the underlying substrate. NV enables independent virtual networks to co-exist on one or more shared physical network infrastructure. Edge computing makes use of the edge resources in close proximity to end-users to reduce service delay and the network traffic volume in the end-to-end networks. Similarly, network slicing which is a key enabling technology for 5G networks is designed to support different services from different platforms at different scales enables sharing of physical network infrastructure on many different virtual network layers. These innovative technologies and strategies have gained significant attention from both academia and industry as they have the potential to maximize network resource utilization and optimize end–to–end network service delivery in 5G solutions deployment. To enable continuous simulation and development of applicable 5G networking concepts using these technologies, there is a need for an accessible and easy-to-learn testbed which is able to efficiently measure the performance of physical and virtual network capacities, provisioning approaches and management of multiple architectural models using large-scale network slicing configurations in a repeatable and controllable manner. These tools and toolkits provide scalable, lightweight and controlled cloud simulation environments necessary to analyse network traffic flows, allocation capacities and policies and the behaviour of multiple heterogeneous networks at an extremely low cost as compared to the huge financial commitments involved in conducting similar experiments in a real-life event. Existing solutions do not support Network Slicing and end- to -end heterogenous network automation which are key enablers of 5G network implementation. Hence in this paper, the CloudSimHypervisor framework is developed in this based on CloudSimSDN-NFV. The complete architecture and features of the CloudSimHypervisor framework and some used cases are presented in this paper. We validate the CloudSimHypervisor framework with two use case experiments in the cloud computing environment: Joint compute and network resource utilization and network traffic prioritization. Results from these experiments display the efficiency of the CloudSimHypervisor in estimating and measuring processing speed, transmission speed, compute and network usage efficiency and energy consumption.",IEEE Access,2021,10.1109/access.2021.3079501,"Maozhen Li, H. Al-Raweshidy, Andrews O. Nyanteh, M. Abbod",1.0,1
53,Renovation of EdgeCloudSim: An Efficient Discrete-Event Approach,"Due to the growing popularity of the Internet of Things, edge computing concept has been widely studied to relieve the load on the original cloud and networks while improving the service quality for end-users. To simulate such a complex environment involving edge and cloud computing, EdgeCloudSim has been widely adopted. However, it suffers from certain efficiency and scalability issues due to the ignorance of the deficiency in the originally adopted data structures and maintenance strategies. Specifically, it generates all events at beginning of the simulation and stores unnecessary historical information, both result in unnecessarily high complexity for search operations. In this work, by fixing the mismatches on the concept of discrete-event simulation, we propose enhancement of EdgeCloudSim which improves not only the runtime efficiency of simulation, but also the flexibility and scalability. Through extensive experiments with statistical methods, we show that the enhancement does not affect the expressiveness of simulations while obtaining 2 orders of magnitude speedup, especially when the device count is large.",International Conference on Fog and Mobile Edge Computing,2021,10.1109/fmec54266.2021.9732572,"Raphael Freymann, Junjie Shi, Kuan-Hsun Chen, Jian-Jia Chen",1.0,1
56,Cloud Simulation for Continuous Integration and Deployment in Robotics,"Continuous Integration and Deployment in the robotics domain is still underutilized when compared to other fields of software development. Also, conventional testing techniques used in CI/CD pipelines are usually not enough to fully test a robotic project in its integrity. In this paper, an analysis is made regarding the usage of CI/CD techniques in robotic related repositories to both verify the veracity of these statements, as well as finding their causes. Additionally, a novel approach in the scope of CI/CD is explored, making use of cloud-based technologies to add additional automated simulation tests to the pipeline and integrate them with ease in the development of robotic software. Finally, the proposed approach is showcased in an industrial application.",International Conference on Industrial Informatics,2021,10.1109/indin45523.2021.9557476,"G. Veiga, Rafael Arrais, Sérgio Teixeira",1.0,1
87,CM Cloud Simulator: A Cost Model Simulator Module for Cloudsim,"The vast cloud computing environment holds out good prospects for researchers in the computing technology field. However, with several Cloud providers offering different pricing models, the evaluation and modeling of Cloud environments and applications are getting harder because there is a lack of tools for this task. We propose the CM Cloud Simulator to fill this gap since it provides a comprehensive and dynamic simulation of applications with various deployment configurations and incurs the cost it would require when implemented in a Cloud Provider, according to the cost model of any service provider. The CM Cloud Simulator also provides custom-built cost models through the XML file.",World Congress on Services,2016,10.1109/services.2016.20,"M. Peixoto, B. Batista, S. Reiff-Marganiec, Dionisio Machado Leite Filho, B. Kuehne, D. C. Alves",1.0,1
114,FTCloudSim: support for cloud service reliability enhancement simulation,"Recently, an increasing number of companies have begun to deploy their application services in the cloud. However, the cloud data centre downtime has negatively affected the quality of cloud service. Many researchers have studied the problem of cloud service reliability assurance. However, there is a shortage of tools that enable researchers to evaluate their newly proposed cloud service reliability enhancement mechanisms. To fill this gap, in this paper, we propose FTCloudSim as a reliable cloud data centre simulation system based on the basic functionalities of CloudSim. FTCloudSim provides an extensible interface to help researchers implement new cloud service reliability enhancement mechanisms. In addition, FTCloudSim can also study the behaviour of the newly proposed mechanisms. We demonstrate the capabilities of FTCloudSim by using five reliability enhancement mechanisms. The results indicate the benefits of our proposed simulation system.",International Journal of Web and Grid Services,2015,10.1504/ijwgs.2015.072804,"Ao Zhou, Qibo Sun, Fangchun Yang, Chenchen Yang, Lei Sun, Shangguang Wang",1.0,1
161,CloudSim Plus: First public pre-release,,,2016,10.1109/services.2016.20,"M. Freire, Raysa L. Oliveira, Manoel C. Silva Filho",1.0,1
31,A Study on Cloud Simulation Tools,"Cloud computing is an emerging technology, advancing quickly in IT due to the flexibility of using computing without buying any infrastructure but by using as pay-per-use model. It is risky to evaluate the performance of cloud environments as cloud computing adoption increases. The simulation technology has become a powerful tool in cloud computing research community to address these issues. Various cloud simulators have been precisely developed for testing and performance analysis of cloud computing environments. This paper presents a study, analysis and comparison of various existing cloud simulation tools.",,2015,10.5120/20220-2500,"Y. Devi, Kalpana Ettikyala",0.9,1
146,An Analytical Study of Comparison Between GridSim Vs CloudSim Simulators,"The Grid Modeling and Simulation (GridSim) toolkit provides a comprehensive facility for simulation of application scheduling in different Grid computing environments. This paper presents a Java-based Graphical User Interface (GUI) tool called Visual Modeler (VM) which is developed as an additional component on top of the GridSim toolkit. Cloud computing aims to power the next generation data centers and enables application service providers to lease data center capabilities for deploying applications depending on user QoS (Quality of Service) requirements. To simplify this process, in this paper we propose CloudSim: an extensible simulation toolkit that enables modelling and simulation of Cloud computing environments. The CloudSim toolkit supports modelling and creation of one or more virtual machines (VMs) on a simulated node of a Data Center, jobs, and their mapping to suitable VMs. In this paper, we present the analytical comparison between two different environments are GridSim and CloudSim with experimental results and representing some result graphs.",,2015,10.5148/tncr.2015.7306,A. Nayyar,0.9,1
29,An HLA-Based Cloud Simulator for Mobile Cloud Environments,"Mobile Cloud Computing is a concept infrastructure wherein Cloud Computing resources are utilized to offload tasks from mobile elements. The combination of Cloud Computing and Mobile Computing increases the complexity of modeling and performance evaluation in terms of task scheduling policies, energy consumption model, the mobility of mobile devices over a layered architecture of both local Clouds and remote Cloud data centers. In this paper, a distributed HLA-based Cloud toolkit is proposed, enabling the modeling and simulation of Mobile Cloud Computing environment. The proposed toolkit simulates the behaviors of the Mobile system and the Cloud infrastructure, within which different resource scheduling policies can be evaluated in a repeatable manner. In addition, an HLA-based simulation scheduling scheme is proposed, trying to improve simulation execution efficiency by automatically parallelizing and distributing simulation components. A Cloud-based simulation resource management paradigm is also implemented, handling the configuration and maintenance issues regarding underlying system resources and simulation data. Based on the experiments, the proposed toolkit can achieve better simulation execution efficiency, with consideration of both Cloud and Mobile behaviors, compared to current Cloud Computing environment simulators.",IEEE International Symposium on Distributed Simulation and Real-Time Applications,2016,10.1109/ds-rt.2016.23,"R. E. Grande, A. Boukerche, Shichao Guan",0.8888890000000000,1
10,Does CloudSim Accurately Model Micro Datacenters?,"Novel cloud computing algorithms and techniques are initially evaluated via testbeds, simulators and mathematical models of datacenter infrastructure. However, it can be difficult to perform cross validation of these platforms against realistic scale infrastructures due to the prohibitive costs involved. This paper describes an approach to evaluating a cloud simulator through an empirical study involving a micro datacenter of commodity Raspberry Pi devices. To demonstrate the methodology, we compare performance of real-world workloads on this physical infrastructure against corresponding models of the workloads and infrastructure on the CloudSim simulator. After modelling a Raspberry Pi micro datacenter in CloudSim, we claim that the simulator lacks sufficient accuracy for cloud infrastructure experiments.",IEEE International Conference on Cloud Computing,2017,10.1109/cloud.2017.97,"Dhahi Alshammari, Jeremy Singer, Timothy Storer",0.875,1
102,Modelling Low Power Compute Clusters for Cloud Simulation,"In order to minimise their energy use, data centre operators are constantly exploring new ways to construct computing infrastructures. As low power CPUs, exemplified by ARM-based devices, are becoming increasingly popular, there is a growing trend for the large scale deployment of low power servers in data centres. For example, recent research has shown promising results on constructing small scale data centres using Raspberry Pi (RPi) single-board computers as their building blocks. To enable larger scale experimentation and feasibility studies, cloud simulators could be utilised. Unfortunately, state-of-the-art simulators often need significant modification to include such low power devices as core data centre components. In this paper, we introduce models and extensions to estimate the behaviour of these new components in the DISSECT-CF cloud computing simulator. We show that how a RPi based cloud could be simulated with the use of the new models. We evaluate the precision and behaviour of the implemented models using a Hadoop-based application scenario executed both in real life and simulated clouds.","International Euromicro Conference on Parallel, Distributed and Network-Based Processing",2017,10.1109/pdp.2017.33,"Gábor Kecskeméti, Wajdi Hajji, Fung Po Tso",0.875,1
125,A Compact Cooling-System Model for Transient Data Center Simulations,"The ability to accurately model transient events is a key consideration in the design and operation of reliable and resilient data centers. While a standard compact transient model exists for IT-equipment thermal mass and transient building-envelope models are well known, there are no existing true “black-box” modeling techniques for data center cooling systems. We propose such a compact model which can be incorporated into simple flow-network and detailed CFD models alike. The model idealizes the cooling system as a heat exchanger in series with additional mass. For most data center applications, a “quasi-steady-state” model is sufficient for the heat exchanger portion, however, we also propose a numerical (discretized) approach which may be employed for the complete range of data center (and other) applications. Finally, we perform transient measurements on a small-scale heat exchanger in order to validate the model.",Intersociety Conference on Thermal and Thermomechanical Phenomena in Electronic Systems,2018,10.1109/itherm.2018.8419515,"W. Tian, J. Vangilder, M. Condor, Quentin Menusier, C. Healey",0.8571430000000000,1
149,An Approach Toward Amelioration of a New Cloudlet Allocation Strategy Using Cloudsim,,,2018,10.3103/s0146411618030033,"Riman Mandal, Ranit Mutsuddy, Aritra Roy, Amritap Chowdhury, Sourav Banerjee, U. Biswas",0.8571430000000000,1
179,Generic input template for cloud simulators: A case study of CloudSim,"Cloud computing and its service models, such as Platform as a Service (PaaS), have changed the way that computing resources are allocated to Information and Communications Technology enterprises and users. Although multiple cloud providers support dynamic service provisioning, it is necessary to facilitate the management of the cloud infrastructure and applications in order to allow the continuous refinement of cloud models. Therefore, issues are raised regarding the cloud orchestration, including the flexible portability and interoperability of cloud applications among multiple cloud providers. Having said that, there is a need for a standardized design and management of the cloud use cases (during the creation of scenarios, application's deployment, and patching) to ensure efficient applications' migration between different providers. This paper proposes an artifact, GITS, a generic input template for CloudSim and other cloud simulators. GITS can be provided by PaaS offering to manage the creation, monitoring, administration, and patching of infrastructure and applications in the cloud. GITS defines the cloud schema that can be used with conforming cloud models and independent cloud providers, thus, portability and interoperability can be enabled in PaaS cloud models. GITS focuses on the architecture‐based modeling for cloud infrastructure and application not only in terms of computational resources but also in terms of high availability properties associated with infrastructure and applications. The main objective of the GITS template is to provide the cloud user with a modular, simple, readable, and reusable model that still supports the essential components and provide them with the ability to control the applications' execution, deployment, and other management needs in addition to the allocation environment. This paper describes GITS usage, specifically as an input template for CloudSim.","Software, Practice & Experience",2018,10.1002/spe.2674,"A. Shami, Manar Jammal, Hassan Hawilo, A. Kanso",0.8571430000000000,1
207,Cloud Simulation for Large-Scale Agent-Based Traffic Simulations,"It has always been the goal of urban system simulators to build ever-more detailed simulation models to understand the complex interactions between the different entities in the urban environment. In order to simulate these complex models, the computational power required is significant. The last two decades have shown that this problem of ever-more demanding software has been solved by increasing the processing power of a single CPU, increasing the number of processors of a CPU die and creating a better interconnect between the hardware nodes. The setup of such computing systems is an expensive endeavor and not accessible to everyone due to the complexity of setup and maintenance. Domain experts of smaller and medium-sized institutions are not able to conduct large-scale simulation experiments, since only large research centers like universities, large cooperations or the military can afford this kind of infrastructure. The growth of cloud computing in the last 10 years now allows computing environments to scale on demand. Since the infrastructure and services are comparable in performance to dedicated hardware, not only consumer-oriented web services can be improved, but also scientific simulation experiments can benefit greatly from this development. A high-performance simulation for urban systems is only one example. This thesis introduces a reference architecture for a cloud-based agent-based simulation platform, which allows domain experts of different fields to collaborate on simulation experiments. Apart from defining an abstract architecture, a specific implementation for traffic-simulation experiments has been developed as part of this thesis. This includes the extension of the SEMSim traffic (now CityMoS) simulation platform to be cloud capable as well as a data analysis framework for online data extraction of simulation data with a low bandwidth footprint. The scalability of cloud resources allows for a concurrent simulation-supported search-space exploration without much overhead. In this thesis an approach to improve the search-space exploration even further by using multi-resolution models to reduce the computational overhead when exploring a multi-dimensional search space is given.",,2019,10.1109/vppc46532.2019.8952361,D. Zehe,0.8333330000000000,1
59,Data center simulation for the BM@N experiment of the NICA project,"One of the uppermost tasks in creating a computing system of the NICA complex is predictive modeling of centers for storing and processing data from experimental setups of the complex, in particular, the BM@N experiment, and simulated events of particle collision for comparison with the expected results of real processes of data storage and processing. To solve the effective simulation problem, a new approach was chosen. It is based on the representation of information processes as byte streams and the use of probability distributions of significant data acquisition processes. The article presents the current status of the developed program and the first results of modeling centers for processing and storing data from the BM@N experiment of the NICA complex under different scenarios for launching jobs for the next run scheduled for 2021.",PROCEEDINGS OF THE 24TH INTERNATIONAL SCIENTIFIC CONFERENCE OF YOUNG SCIENTISTS AND SPECIALISTS (AYSS-2020),2021,10.1063/5.0063338,"V. Trofimov, G. Ososkov, K. Gertsenberger, D. Priakhina",0.75,1
124,Criteria for the CloudSim Environment,"CPU is undoubtedly the most important resource of the computer system. Recent advances in software and system architecture have increased processing complexity, as computing is now distributed and parallel. CloudSim represents the complexity of an application in terms of its computational requirements. CloudSim [9] is a complete solution for simulating Cloud Computing environments and building test beds for provisioning algorithms. This paper analyzes and evaluates the performance of cloud environment modeling using CloudSim. We describe the CloudSim architecture and then investigate the new models and techniques in CloudSim.",arXiv.org,2018,10.28991/cej-03091192,"Omid Khatibi, Arezoo Khatibi",0.7142860000000000,1
178,Efficient Energy Sources Scheduling in Green Powered Datacenters: A Cloudsim Implementation,"In this paper we address the issue of managing different energy sources which supply green powered datacenters. The sources are scheduled based on a priority scheme, aiming to maximize the renewable energy utilization, minimize the energy used from the grid and optimize battery usage. Dynamic power capping technique is used to put a threshold on the drawn energy from the grid. The algorithm is implemented and tested in CloudSim simulator. Renewable energy is considered as solar energy. A workload scheduling algorithm is already implemented for higher renewable energy utilization. The results show that the proposed scheme is efficient and it is a promising direction in the field of the optimization in datacenters using renewable energy.",,2016,10.1109/softcom.2016.7772131,"J. Pierson, N. Frasheri, P. Stolf, Enida Sheme, Georges Da Costa",0.6666670000000000,1
208,Optimization of Cloud Data Center using CloudSim – A methodology,"Cloud computing can be termed as provisioning of computing power, storage, Infrastructure and other resources over the internet as an on-demand pay service. Recent developments in the technological advancement are in the cloud storage, security, fault tolerances, load balancing and optimization. Cloud simulator is a tool that assists in modelling different cloud applications. Cloudism offers a simulation framework for modelling and simulation that emphasis more on exploring design issues without factoring cloud infrastructure and services. Load balancing in cloud is a method of allocation of workload across multiple nodes to obtain resource optimization with minimum response time. In this paper the state of the art of the cloud simulations along with an approach implemented using CloudSim3.0 is illustrated.",International Conference on Computing and Convergence Technology,2019,10.1109/iccct2.2019.8824950,"B. Priya, T. Gnanasekaran",0.6666670000000000,1
136,Single Sign-On in Cloud Federation using CloudSim,"Single Sign-On (SSO) is an authentication mechanism in which a Cloud Service Consumer (CSC) needs to be authenticated only once while accessing various services from multiple service providers, or when accessing multiple services from the same service provider. In the case of Cloud Federation, the consumers can get services from various Cloud Service Providers (CSPs) who are members of the federation, and SSO can be used to verify the legitimate users without requiring them to get authenticated with each service provider separately. CloudSim is a popular tool used for simulating various cloud computing scenarios. As of now, the simulator lacks effective user authentication and authorization methods with it. In this paper, we discuss the design and implementation of SSO mechanism in the Cloud Federation scenario using the CloudSim toolkit. We have used the Fully Hashed Menezes-Qu-Vanstone (FHMQV) protocol for the key exchange and the Symmetric Key Encryption technique AES-128 for encrypting the identity tokens. We give the workflow model for the proposed approach of SSO in the Cloud Federation and also, the execution time taken in the simulation for various Single Sign-On scenarios where the number of SSO required varies are also shown.",,2015,10.5815/ijcnis.2015.06.06,"A. Dhole, Manoj V. Thomas, K. Chandrasekaran",0.6,1
163,Proposal for standard compact server model for transient data center simulations,,,2015,10.1115/ipack2015-48448,"Zachary M. Pardey, D. Demetriou, H. Khalifa, H. Erden, J. Vangilder, R. Schmidt",0.6,1
234,WEAVESIM: A SCALABLE AND REUSABLE CLOUD SIMULATION FRAMEWORK LEVERAGING ASPECT-ORIENTED PROGRAMMING,,,2020,10.5455/jjcit.71-1579451674,"Amin Jarrah, M. Hammad, Sawsan Alshattnawi, Anas Alsobeh",0.6,1
